ID,Name,Year,Duration,Interests,Description,Directors,Writers,Stars
tt12704978,Audrey's Children (2024),2024.0,1h 50m,"Biography,Drama","1969. Dr. Audrey Evans joins world-renowned children's hospital and battles sexism, medical conventions, and the subterfuge of her peers to develop revolutionary treatments and purchase the ...",Ami Canaan Mann,Julia Fisher Farbman,"Natalie Dormer,Clancy Brown,Jimmi Simpson"
tt18108824,The Friend (2024),2024.0,2h,Drama,"Follows a story of love, friendship, grief and healing, about a writer who adopts a Great Dane that belonged to a late friend and mentor.","Scott McGehee,David Siegel","Scott McGehee,David Siegel,Sigrid Nunez","Bill Murray,Naomi Watts,Cloé Xhauflaire"
tt34280341,Janis Ian: Breaking Silence (2024),2024.0,1h 54m,"Biography,Documentary,History,Music","The life and songbook of Janis Ian mirrored the awakening of American women in the 1960s and '70s, as they found their voices and embraced their power.",Varda Bar-Kar,"Varda Bar-Kar,Pierre Hauser","Joan Baez,Kye Fleming,Arlo Guthrie"
tt26677014,The Penguin Lessons (2024),2024.0,1h 50m,Drama,"Starring Oscar nominee Steve Coogan, this poignant dramedy from director Peter Cattaneo follows an Englishman's personal and political awakening after he adopts a penguin during a cataclysmi...",Peter Cattaneo,"Jeff Pope,Tom Michell","Steve Coogan,Björn Gustafsson,David Herrero"
tt31314296,The Woman in the Yard (2025),2025.0,1h 28m,"Supernatural Horror,Drama,Horror,Thriller","A mysterious woman repeatedly appears in a family's front yard, often delivering chilling warnings and unsettling messages, leaving them to question her identity, motives and the potential d...",Jaume Collet-Serra,Sam Stefanak,"Danielle Deadwyler,Okwui Okpokwasili,Peyton Jackson"
tt9150192,A Working Man (2025),2025.0,1h 56m,"Conspiracy Thriller,One-Person Army Action,Action,Thriller","Levon Cade left his profession behind to work construction and be a good dad to his daughter. But when a local girl vanishes, he's asked to return to the skills that made him a mythic figure...",David Ayer,"Sylvester Stallone,David Ayer,Chuck Dixon","Jason Statham,Jason Flemyng,Merab Ninidze"
